{
  "$schema": "https://json-schema.org/draft/2020-12/schema",
  "$id": "https://docs.openclaw.ai/schemas/repo_readiness_agent/product-report.schema.json",
  "title": "Repo Readiness Agent product report",
  "type": "object",
  "additionalProperties": false,
  "required": [
    "stage",
    "verdict",
    "confidence",
    "top_risks",
    "top_fixes",
    "gates",
    "follow_up"
  ],
  "properties": {
    "stage": {
      "type": "string",
      "enum": ["Prototype", "MVP", "Handoff-ready"]
    },
    "verdict": {
      "type": "string"
    },
    "confidence": {
      "type": "string",
      "enum": ["Low", "Medium", "High"]
    },
    "top_risks": {
      "type": "array",
      "items": { "type": "string" }
    },
    "top_fixes": {
      "type": "array",
      "items": { "type": "string" }
    },
    "remediation_hints": {
      "anyOf": [
        {
          "type": "array",
          "items": {
            "type": "object",
            "additionalProperties": false,
            "required": ["fix", "target_files", "why", "line_hints"],
            "properties": {
              "fix": { "type": "string" },
              "target_files": {
                "type": "array",
                "items": { "type": "string" }
              },
              "why": { "type": "string" },
              "line_hints": {
                "type": "array",
                "items": { "type": "string" }
              }
            }
          }
        },
        { "type": "null" }
      ]
    },
    "improvement_briefs": {
      "anyOf": [
        {
          "type": "array",
          "items": {
            "type": "object",
            "additionalProperties": false,
            "required": [
              "fix",
              "objective",
              "target_files",
              "why_now",
              "do_it_yourself",
              "delegate_to_engineer",
              "acceptance_criteria",
              "verification_steps"
            ],
            "properties": {
              "fix": { "type": "string" },
              "objective": { "type": "string" },
              "target_files": {
                "type": "array",
                "items": { "type": "string" }
              },
              "why_now": { "type": "string" },
              "do_it_yourself": {
                "type": "array",
                "items": { "type": "string" }
              },
              "delegate_to_engineer": {
                "type": "array",
                "items": { "type": "string" }
              },
              "acceptance_criteria": {
                "type": "array",
                "items": { "type": "string" }
              },
              "verification_steps": {
                "type": "array",
                "items": { "type": "string" }
              }
            }
          }
        },
        { "type": "null" }
      ]
    },
    "delta_brief": {
      "anyOf": [
        {
          "type": "object",
          "additionalProperties": false,
          "required": [
            "summary",
            "what_improved",
            "what_still_blocked",
            "priority_now",
            "founder_action",
            "engineer_action"
          ],
          "properties": {
            "summary": { "type": "string" },
            "what_improved": {
              "type": "array",
              "items": { "type": "string" }
            },
            "what_still_blocked": {
              "type": "array",
              "items": { "type": "string" }
            },
            "priority_now": { "type": "string" },
            "founder_action": { "type": "string" },
            "engineer_action": { "type": "string" }
          }
        },
        { "type": "null" }
      ]
    },
    "gates": {
      "anyOf": [
        {
          "type": "object",
          "additionalProperties": false,
          "required": ["demo_safe", "launch_ready", "handoff_ready"],
          "properties": {
            "demo_safe": { "type": "string", "enum": ["yes", "not yet"] },
            "launch_ready": { "type": "string", "enum": ["yes", "not yet"] },
            "handoff_ready": { "type": "string", "enum": ["yes", "not yet"] }
          }
        },
        { "type": "null" }
      ]
    },
    "follow_up": {
      "anyOf": [
        {
          "type": "object",
          "additionalProperties": false,
          "required": ["status", "stop_condition"],
          "properties": {
            "status": {
              "type": "string",
              "enum": ["Improved", "Unchanged", "Still blocked"]
            },
            "stop_condition": {
              "type": "string",
              "enum": ["Target reached", "Keep monitoring"]
            }
          }
        },
        { "type": "null" }
      ]
    }
  }
}
