{
  "stage": "MVP",
  "verdict": "This repository looks usable for demos or early users, but it still needs focused hardening before handoff.",
  "confidence": "Medium",
  "top_risks": [
    "No CI workflow was detected, so quality gates may rely on manual discipline."
  ],
  "top_fixes": [
    "Add CI to run lint/typecheck/tests on every change."
  ],
  "gates": {
    "demo_safe": "yes",
    "launch_ready": "not yet",
    "handoff_ready": "not yet"
  },
  "follow_up": null
}
