{
  "stage": "MVP",
  "verdict": "This repository looks usable for demos or early users, but it still needs focused hardening before handoff.",
  "confidence": "Medium",
  "top_risks": [
    "At least one very large file was detected, which may indicate concentrated complexity.",
    "No environment example/template was found, which weakens onboarding and config discipline."
  ],
  "top_fixes": [
    "Split oversized files/functions into smaller units with clearer boundaries.",
    "Review the flagged security patterns and remove insecure constructs/defaults.",
    "Add a .env.example or equivalent config template."
  ],
  "gates": {
    "demo_safe": "yes",
    "launch_ready": "not yet",
    "handoff_ready": "not yet"
  },
  "follow_up": null
}
